User Query,Bot Response,Grounding Content
Explain the difference between supervised and unsupervised learning.,"Supervised learning uses labeled data for training, while unsupervised learning finds patterns in unlabeled data.","Supervised learning is a machine learning paradigm that trains algorithms using labeled datasets to learn a mapping function between input features and desired output labels. The goal is to build a model that can accurately predict outcomes or classify new, unseen data based on the patterns and relationships discovered in the training data. This process involves a feedback mechanism where the model iteratively adjusts its internal parameters to minimize the error between its predictions and the provided labels"
What is the curse of dimensionality?,It refers to the challenges and increased sparsity that arise when data has too many features.,The curse of dimensionality refers to the various problems that arise when working with datasets that have a large number of features or dimensions. It's a phenomenon that impacts the effectiveness and efficiency of machine learning algorithms and data analysis in general.
What is the difference between variance and bias in machine learning?,"Bias is the error due to overly simplistic assumptions, and variance is the error due to excessive sensitivity to small fluctuations in training data.","Bias and variance are two fundamental sources of error that prevent machine learning models from generalizing well to new, unseen data. Achieving a balance between them is crucial for building accurate and effective models"
What are Large Language Models (LLMs) used for?,"LLMs are used to understand and generate human-like language for tasks like chatbots, content creation, translation, and summarization.","LLMs are a powerful type of artificial intelligence designed to understand and generate human-like text based on the patterns and structures they learn from vast amounts of data. These models, like OpenAI's GPT-4 and Google's BERT, are trained on massive datasets of human language (e.g., books, articles, websites) and utilize deep learning techniques, particularly transformer architectures, to grasp complex language patterns. This extensive training enables them to not only understand the meaning of language but also generate coherent and contextually relevant text"
What is Cross-validation?,Cross-validation is a technique for evaluating models by training them on different subsets of the data and testing on the remaining data.,"Cross-validation is a resampling technique used to evaluate the performance of machine learning models and to assess how well they generalize to new, unseen data. It's a method that helps prevent overfitting, where a model performs well on the training data but poorly on unseen data due to learning noise and specific patterns rather than the underlying relationships"
